{
  "schema_version": "1.0",
  "packet_id": "packet-aaaaaaaaaaaaaaaaaaaaaaaaaaaaaaaa",
  "packet_digest": "sha256:bbbbbbbbbbbbbbbbbbbbbbbbbbbbbbbbbbbbbbbbbbbbbbbbbbbbbbbbbbbbbbbb",
  "adjudicator": "Independent reviewer",
  "assessed_at": "2026-08-19T12:00:00Z",
  "assessments": [
    {
      "assignment_id": "assignment-cccccccccccccccccccccccccccccccc",
      "mechanism_decision": "no_match",
      "validity": "valid",
      "issue_kind": "documentation",
      "additional_issue_group": "issue-stale-command-example",
      "rationale": "The documented command does not match the implemented CLI."
    }
  ],
  "content_digest": "sha256:9500189465908431b39bd6930f5bb78b7352b6d1e77e516ccaf5ec95c776f6b9"
}
